Description;Units;2001;2002;2003;2004;2005;2006;2007;2008;2009;2010;2011;2012;2013;2014
Mineral water;ml;46;53;53;62;64;70;62;49;47;48;47;41;47;50
Soft drink (incl carbonates and still) - low calorie;ml;57;54;59;44;46;44;36;36;33;46;47;35;39;39
Soft drink (incl carbonates & still) - not low calorie (including drinks where calorie content unspecified);ml;238;239;239;213;203;195;179;174;171;153;142;144;135;119
Pure fruit juices;ml;17;16;17;15;16;18;17;17;16;15;16;15;14;14
Vegetable juices (e.g. tomato juice, carrot juice);ml;0;0;1;0;0;0;0;0;0;0;0;0;0;0
Soft drink where pure juice or juice drink not specified;ml;0;0;0;0;0;0;0;0;0;0;1;2;13;25
